{
  "format": "fog-of-sea-lattice-copy-inventory-v1",
  "version": "1.0.0",
  "scope": {
    "unitCount": 42,
    "requestCount": 24,
    "outputCount": 31,
    "sourceSymbolCount": 12,
    "academyLintMode": "advisory-curriculum-data",
    "broadAdoptionStatus": "blocked",
    "statement": "This inventory distinguishes the selected 24-request, 31-output static-copy slice from advisory, exact-copy, user-authored, and blocked product families."
  },
  "units": [
    {
      "id": "FOS-COPY-DEBRIEF-001",
      "family": "debrief",
      "surfaceName": "Outcome after-action learning",
      "description": "Interpretive outcome copy for no final finding, committed uncertainty, and recorded diagnostic findings.",
      "status": "adopted",
      "exemptionReason": null,
      "route": {"layer": "interpretive", "surface": "after-action", "mode": "aftermath", "stakes": "consequential", "representation": "both"},
      "targetAssurance": "strong",
      "owners": [
        {"path": "app/kriegsspiel.ts", "role": "Selects copy from typed outcome state"},
        {"path": "app/ResultDebrief.tsx", "role": "Publishes outcome learning"}
      ],
      "requestIds": ["fos.game.learning.outcome-clear", "fos.game.learning.outcome-uncertainty", "fos.game.learning.outcome-adjustment"],
      "outputTargets": ["game.learning.outcome.clear", "game.learning.outcome.uncertainty", "game.learning.outcome.adjustment"],
      "requirementIds": ["FOS-LAT-SEM-001", "FOS-LAT-LAY-001", "FOS-LAT-DOM-001", "FOS-LAT-DEB-001"],
      "risks": ["Invented blame", "Unproved causal ranking", "A score treated as a diagnostic finding"],
      "supersedes": []
    },
    {
      "id": "FOS-COPY-DEBRIEF-002",
      "family": "debrief",
      "surfaceName": "Outcome review pending",
      "description": "Immediate pending-state copy before a final after-action review exists.",
      "status": "adopted",
      "exemptionReason": null,
      "route": {"layer": "operative", "surface": "after-action", "mode": "aftermath", "stakes": "ambient", "representation": "both"},
      "targetAssurance": "controlled-literal",
      "owners": [
        {"path": "app/kriegsspiel.ts", "role": "Selects the pending state"},
        {"path": "app/CommandPanel.tsx", "role": "Publishes the pending outcome-review state during command play"}
      ],
      "requestIds": ["fos.game.learning.outcome-pending"],
      "outputTargets": ["game.learning.outcome.pending"],
      "requirementIds": ["FOS-LAT-SEM-001", "FOS-LAT-LAY-001", "FOS-LAT-SEM-002", "FOS-LAT-DEB-001"],
      "risks": ["Implying an outcome exists before completion"],
      "supersedes": []
    },
    {
      "id": "FOS-COPY-DEBRIEF-003",
      "family": "debrief",
      "surfaceName": "Turn and outcome technical report copy",
      "description": "Post-resolution turn status plus the exact statement that player writing was not evaluated.",
      "status": "adopted",
      "exemptionReason": null,
      "route": {"layer": "operative", "surface": "report", "mode": "technical", "stakes": "consequential", "representation": "both"},
      "targetAssurance": "controlled-literal",
      "owners": [
        {"path": "app/kriegsspiel.ts", "role": "Selects report copy from typed state"},
        {"path": "app/CommandPanel.tsx", "role": "Publishes turn learning"},
        {"path": "app/ResultDebrief.tsx", "role": "Publishes outcome notes"}
      ],
      "requestIds": ["fos.game.learning.turn-clear", "fos.game.learning.turn-uncertainty", "fos.game.outcome.unscored-writing"],
      "outputTargets": ["game.learning.turn.clear", "game.learning.turn.uncertainty", "game.outcome.unscoredWriting"],
      "requirementIds": ["FOS-LAT-SEM-001", "FOS-LAT-LAY-001", "FOS-LAT-SEM-002", "FOS-LAT-DOM-001", "FOS-LAT-DOM-002", "FOS-LAT-DEB-001"],
      "risks": ["Hidden-rule inference", "Numeric-rules-only overclaim", "Prose used as a diagnostic code"],
      "supersedes": []
    },
    {
      "id": "FOS-COPY-GUIDE-001",
      "family": "field-guide",
      "surfaceName": "Technical guide interpretive layer",
      "description": "Interpretation following the exact scenarioAcceptance and uncrewedUndersea mechanics.",
      "status": "adopted",
      "exemptionReason": null,
      "route": {"layer": "interpretive", "surface": "tutorial", "mode": "technical", "stakes": "consequential", "representation": "both"},
      "targetAssurance": "advisory",
      "owners": [{"path": "app/page.tsx", "role": "Publishes Field Guide technical interpretation"}],
      "requestIds": ["fos.game.guide.scenario-acceptance", "fos.game.guide.uncrewed-undersea"],
      "outputTargets": ["game.guide.scenarioAcceptance.interpretive", "game.guide.uncrewedUndersea.interpretive"],
      "requirementIds": ["FOS-LAT-SEM-001", "FOS-LAT-LAY-001", "FOS-LAT-GUI-001"],
      "risks": ["Interpretation widening a bounded rule"],
      "supersedes": []
    },
    {
      "id": "FOS-COPY-GUIDE-002",
      "family": "field-guide",
      "surfaceName": "Technical guide operative layer",
      "description": "Exact coexistence and employment mechanics for scenarioAcceptance and uncrewedUndersea.",
      "status": "adopted",
      "exemptionReason": null,
      "route": {"layer": "operative", "surface": "tutorial", "mode": "technical", "stakes": "consequential", "representation": "both"},
      "targetAssurance": "controlled-literal",
      "owners": [{"path": "app/page.tsx", "role": "Publishes Field Guide technical rules"}],
      "requestIds": ["fos.game.guide.scenario-acceptance", "fos.game.guide.uncrewed-undersea"],
      "outputTargets": ["game.guide.scenarioAcceptance.operative", "game.guide.uncrewedUndersea.operative"],
      "requirementIds": ["FOS-LAT-SEM-001", "FOS-LAT-LAY-001", "FOS-LAT-SEM-002", "FOS-LAT-GUI-001"],
      "risks": ["Scenario coexistence overstated as feasibility", "Employment penalties omitted"],
      "supersedes": []
    },
    {
      "id": "FOS-COPY-GUIDE-003",
      "family": "field-guide",
      "surfaceName": "Action guide operative layer",
      "description": "Exact missionCredit and commandTurns actions, state changes, and reproducibility rule.",
      "status": "adopted",
      "exemptionReason": null,
      "route": {"layer": "operative", "surface": "tutorial", "mode": "action", "stakes": "consequential", "representation": "both"},
      "targetAssurance": "controlled-literal",
      "owners": [{"path": "app/page.tsx", "role": "Publishes Field Guide action rules"}],
      "requestIds": ["fos.game.guide.mission-credit", "fos.game.guide.command-turns"],
      "outputTargets": ["game.guide.missionCredit.operative", "game.guide.commandTurns.operative"],
      "requirementIds": ["FOS-LAT-SEM-001", "FOS-LAT-LAY-001", "FOS-LAT-SEM-002", "FOS-LAT-GUI-001"],
      "risks": ["Selection confused with mission credit", "Undo described as rerolling"],
      "supersedes": []
    },
    {
      "id": "FOS-COPY-GUIDE-004",
      "family": "field-guide",
      "surfaceName": "Action guide interpretive layer",
      "description": "Interpretation following the exact missionCredit and commandTurns rules.",
      "status": "adopted",
      "exemptionReason": null,
      "route": {"layer": "interpretive", "surface": "tutorial", "mode": "action", "stakes": "consequential", "representation": "both"},
      "targetAssurance": "advisory",
      "owners": [{"path": "app/page.tsx", "role": "Publishes Field Guide action interpretation"}],
      "requestIds": ["fos.game.guide.mission-credit", "fos.game.guide.command-turns"],
      "outputTargets": ["game.guide.missionCredit.interpretive", "game.guide.commandTurns.interpretive"],
      "requirementIds": ["FOS-LAT-SEM-001", "FOS-LAT-LAY-001", "FOS-LAT-GUI-001"],
      "risks": ["Register fit obscuring consequence"],
      "supersedes": []
    },
    {
      "id": "FOS-COPY-GUIDE-005",
      "family": "field-guide",
      "surfaceName": "Analysis guide operative layer",
      "description": "Exact strategicFit relationships and unscored-writing boundary.",
      "status": "adopted",
      "exemptionReason": null,
      "route": {"layer": "operative", "surface": "tutorial", "mode": "analysis", "stakes": "consequential", "representation": "both"},
      "targetAssurance": "controlled-literal",
      "owners": [{"path": "app/page.tsx", "role": "Publishes Field Guide analysis boundary"}],
      "requestIds": ["fos.game.guide.strategic-fit"],
      "outputTargets": ["game.guide.strategicFit.operative"],
      "requirementIds": ["FOS-LAT-SEM-001", "FOS-LAT-LAY-001", "FOS-LAT-SEM-002", "FOS-LAT-GUI-001"],
      "risks": ["Player prose implied to influence score"],
      "supersedes": []
    },
    {
      "id": "FOS-COPY-GUIDE-006",
      "family": "field-guide",
      "surfaceName": "Analysis guide interpretive layer",
      "description": "Interpretation following the exact strategicFit boundary.",
      "status": "adopted",
      "exemptionReason": null,
      "route": {"layer": "interpretive", "surface": "tutorial", "mode": "analysis", "stakes": "consequential", "representation": "both"},
      "targetAssurance": "advisory",
      "owners": [{"path": "app/page.tsx", "role": "Publishes Field Guide analysis interpretation"}],
      "requestIds": ["fos.game.guide.strategic-fit"],
      "outputTargets": ["game.guide.strategicFit.interpretive"],
      "requirementIds": ["FOS-LAT-SEM-001", "FOS-LAT-LAY-001", "FOS-LAT-GUI-001"],
      "risks": ["Interpretation presented as a scored strategy judgment"],
      "supersedes": []
    },
    {
      "id": "FOS-COPY-GUIDE-007",
      "family": "field-guide",
      "surfaceName": "Public-notice guide operative layer",
      "description": "Exact fictional model and non-operational boundary.",
      "status": "adopted",
      "exemptionReason": null,
      "route": {"layer": "operative", "surface": "public-notice", "mode": "technical", "stakes": "consequential", "representation": "both"},
      "targetAssurance": "controlled-literal",